,nombre,precio,rating
0,Tenis Grand Court Para Tenis -blanco adidas,"$1,149",Blanco (632)
1,Tenis Tensaur Sport Training Cierre Por Contacto adidas,$69,Negro (488)
2,Tenis Tensaur Sport Training Cierre De Cordones adidas,$899,Gris (111)
3,Tenis Urban Court If4093 adidas,$54,Azul (97)
4,Tenis Breaknet 2.0 Id0472 adidas,$999,Verde (63)
5,Tenis De Running Galaxy 7 Id8770 adidas,$60,Rosa (55)
6,Tenis Casual adidas Grand Court Alpha Rojo Para Mujer,$999,Rojo (46)
7,Tenis adidas Hoops Mid Joven Ig3715,$60,Beige (39)
8,Tenis adidas Advantage Joven Ie9020,"$1,249",Amarillo (28)
9,Tenis Tensaur Sport Training Cierre De Cordones Gw6425 Adida,$75,Azul marino (18)
11,Tenis Showtheway 2.0 Gy4702 adidas,$90,Calificación 4.6 de 5. 146 opiniones.
12,Tenis adidas Advantage Niña Id5295,"$1,799",Calificación 4.9 de 5. 65 opiniones.
13,Tenis adidas Caballero Tensaur Run 2.0 Negro Hombre Jr,$108,Calificación 4.7 de 5. 132 opiniones.
14,Breaknet 2.0 Cf I Id5280 adidas,"$1,099",Calificación 4.8 de 5. 100 opiniones.
15,Tenis adidas Unisex Courtblock Calzado Comodo Deportivo,$66,Calificación 4.6 de 5. 113 opiniones.
16,Tenis adidas Hoops 3.0 Blanco Con Rosa Para Mujer Jr,$849,Calificación 4.7 de 5. 107 opiniones.
17,Tenis Joven adidas Hoops Gz9647 Simipiel Blanco,$51,Calificación 5 de 5. 2 opiniones.
18,Tenis adidas Mujer Advantage Lifestyle Court Blanco Dama Jr,$999,Calificación 5 de 5. 6 opiniones.
19,Tenis adidas Grand Court Court Cordones Elásticos Y Tira Reg,$60,Calificación 4.8 de 5. 6 opiniones.
21,Tenis Joven adidas Hoops 3.0 Gw0433 Simipiel Blanco,$69,Calificación 4.8 de 5. 32 opiniones.
22,Tenis Advantage adidas Court Ig2511 adidas,"$1,299",Calificación 5 de 5. 17 opiniones.
23,Tenis Joven adidas Tensaur Gw6422 Simipiel Blanco,$78,Calificación 4.4 de 5. 9 opiniones.
24,Tenis Tensaur Sport 2.0 adidas Doble Velcro Blanco Rosa Niña,$849,Calificación 4.7 de 5. 7 opiniones.
25,Zapatillas Advantage Lifestyle Court - Negro adidas,$51,Calificación 4.4 de 5. 15 opiniones.
26,Tenis adidas Grand Court 2.0 Blanco Con Velcro Para Niña,$999,Calificación 4.4 de 5. 27 opiniones.
27,Tenis Tensaur Sport Training Cierre De Cordones Gw6422 Adida,$166,Calificación 4.9 de 5. 60 opiniones.
28,Tenis Casual adidas Hoops 3.0 K Cómodo Blanco,$713,Calificación 4.3 de 5. 14 opiniones.
29,Tenis Joven adidas Goletto Gy5782 Simipiel Blanco,$43,Calificación 5 de 5. 22 opiniones.
30,Tenis Joven adidas H06160 Simipiel Blanco,"$1,043",Calificación 4.7 de 5. 101 opiniones.
31,Tenis Grand Court Lifestyle Para Tenis - Negro adidas,$63,Calificación 4.8 de 5. 13 opiniones.
32,Tenis Runfalcon 3 Sport Running Lace Hp5842 adidas,$999,Calificación 4.7 de 5. 412 opiniones.
33,Tenis adidas Cross Em Up Select J Wide Básquet Niños,$166,Calificación 4.8 de 5. 21 opiniones.
35,Tenis Tensaur Sport Training Cierre Por Contacto adidas,$66,Calificación 5 de 5. 3 opiniones.
36,Tenis Duramo Sl Para Niños Ig2478 adidas,"$1,099",Calificación 4.8 de 5. 16 opiniones.
37,Tenis Hoops Ig3830 adidas,$183,Calificación 4.6 de 5. 113 opiniones.
38,Tenis adidas Grand Court Joven Gw6503 Simipiel Negro,"$1,099",Calificación 4.4 de 5. 66 opiniones.
39,Tenis Joven adidas Goletto Gy5781 Simipiel Ngo,$66,Calificación 4.8 de 5. 10 opiniones.
40,Tenis Breaknet Lifestyle adidas Court Cordones Hp8956 adidas,$999,Calificación 4.8 de 5. 10 opiniones.
41,Tenis adidas Grand Court 2.0 Kids Ie2752 adidas,$60,Calificación 4.9 de 5. 57 opiniones.
42,Tenis Casuales Para Joven adidas  Ef0212 Negro,$999,Calificación 4.7 de 5. 18 opiniones.
43,Tenis Para Correr adidas Duramo Sl K Marino Para Niño,$60,Calificación 4.7 de 5. 11 opiniones.
44,Tenis Tensaur Sport Training Cierre De Cordones adidas,$949,Calificación 4.8 de 5. 9 opiniones.
45,Tenis Advantage X Marvel Kids Id8016 adidas,$57,Calificación 5 de 5. 2 opiniones.
46,Tenis Joven adidas Advantage Gy6995 Simipiel Blanco ,$999,Calificación 4.9 de 5. 13 opiniones.
47,Runfalcon 3 Lace Shoes Hp5840 adidas,$60,Calificación 5 de 5. 4 opiniones.
48,Tenis Grand Court Para Tenis -blanco adidas,$999,Calificación 4.7 de 5. 132 opiniones.
49,Tenis adidas Grand Court Lifestyle Court Cordones Elásticos ,$166,Calificación 5 de 5. 17 opiniones.
50,Tenis Tensaur Sport Training Cierre Por Contacto adidas,$949,Calificación 4.8 de 5. 23 opiniones.
51,Tenis Duramo Sl Kids Id2627 adidas,$57,Calificación 4.7 de 5. 41 opiniones.
52,Tenis Tensaur Tira Ajustable De Cierre Por Contacto H06301 A,"$1,099",Calificación 4.6 de 5. 146 opiniones.
53,Tenis Hoops Mid Ig3715 adidas,$183,Calificación 4.9 de 5. 139 opiniones.
54,Tenis Tensaur Sport Training Cierre De Cordones adidas,$999,
55,Tenis Tensaur Sport Training Cierre De Cordones Gw6425 Adida,$60,
56,Tenis Grand Court Para Tenis -blanco adidas,$999,
57,Tenis Tensaur Tira Ajustable De Cierre Por Contacto Ig8803 A,$60,
58,Tenis Joven adidas Advantage H06179 Simipiel Blanco,"$1,149",
59,Tenis Tensaur Sport Training Cierre De Cordones Gw6425 Adida,$69,
60,Tenis Con Cordones Grand Court Lifestyle Para Tenis Gy2326 A,$899,
61,Tenis Correr adidas Tensaurus Gw6423 Simipiel Blanco,$54,
62,Tenis Lite Racer 3.0 Ie1133 adidas,"$1,099",
63,Tenis Tensaur Sport Training Cierre Por Contacto adidas,$66,
65,Tenis Showtheway 2.0 Gy4702 adidas,$60,Calificación 4.7 de 5. 132 opiniones.
66,Tenis Tensaur Run Ig1244 adidas,"$1,149",Calificación 4.8 de 5. 100 opiniones.
67,Tenis Advantage (unisex) -white adidas,$69,Calificación 4.6 de 5. 146 opiniones.
68,Tenis adidas Tensaur Sport I Negro Con Blanco Infantil,$999,Calificación 4.8 de 5. 24 opiniones.
69,Tenis X_plr Niños If1477 adidas,$60,Calificación 4.8 de 5. 4 opiniones.
70,Tenis Advantage Lifestyle adidas Court Con Cordones Gy6995 A,$999,Calificación 4.8 de 5. 100 opiniones.
71,Tenis X_plr Niños Id0254 adidas,$60,Calificación 4.8 de 5. 91 opiniones.
72,Runfalcon 3 Lace Shoes Hp5837 adidas,$899,Calificación 5 de 5. 9 opiniones.
73,Tenis adidas Para Niño Forum Low Calzado Deportivo Y Cómodo,$54,Calificación 4.6 de 5. 63 opiniones.
74,Tenis Joven adidas Hoops Gw3020 Simipiel Negro,"$1,149",Calificación 4.9 de 5. 65 opiniones.
75,Tenis adidas Para Niños Tensaur Sport 2k Zapato Deportivo,$69,Calificación 4.6 de 5. 113 opiniones.
76,Tenis Breaknet Lifestyle adidas Court Cordones Hp8961 adidas,"$1,299",Calificación 4.7 de 5. 107 opiniones.
77,Tenis adidas Grand Court 2.0 Para Bebé Id5267 adidas,$78,Calificación 5 de 5. 3 opiniones.
78,Tenis adidas Tensaur Niña Id2303,$999,Calificación 4.8 de 5. 37 opiniones.
79,Tenis adidas Grand Court Lifestyle Para Tenis Con Cordones I,$60,Calificación 4.7 de 5. 60 opiniones.
81,Tenis Lite Racer 3 Id3398 adidas,$57,Calificación 5 de 5. 1 opiniones.
82,Tenis Joven adidas Grand Court Gv6796 Simipiel Blanco,"$849,15",Calificación 5 de 5. 4 opiniones.
83,Tenis Casual adidas Breaknet Mickey 2.0 Cf I Blanco De Niño,$141,Calificación 4.9 de 5. 34 opiniones.
85,Tenis Lite Racer 3 Id3393 adidas,$66,Calificación 4.8 de 5. 6 opiniones.
86,Tenis adidas Para Niño Tensaur 2 Calzado Deportivo Y Cómodo,$949,Calificación 4.8 de 5. 6 opiniones.
89,Tenis adidas Suru365 Mickey  Entrenar Niños,$66,Calificación 5 de 5. 3 opiniones.
90,Tenis adidas Tensaur Sport 2.0 Crema Doble Velcro Para Niña,"$1,049",Calificación 4.9 de 5. 7 opiniones.
91,Tenis adidas Grand Court X Marvel Spider-man Niños Ig7168 Ad,$63,Calificación 5 de 5. 4 opiniones.
92,Tenis Casual adidas Breaknet 2.0 Mickey El K Blanco De Niño,"$1,994",Calificación 4 de 5. 4 opiniones.
95,Tenis adidas Grand Court Minnie Sportswear Kids Id8018 Adida,$96,Calificación 4.7 de 5. 9 opiniones.
97,Tenis Niños  adidas Grand Court Gw6511 Simipiel Blanco,$60,Calificación 4.7 de 5. 25 opiniones.
98,Tenis adidas Niños Infantil Casual Tensaur Sport ,"$1,099",Calificación 4.9 de 5. 22 opiniones.
99,Tenis Tensaur Sport Training Cierre De Cordones Gw6423 Adida,$66,Calificación 5 de 5. 10 opiniones.
100,Tenis Disney Tensaur Sport Para Niños If0930 adidas,$999,Calificación 4.7 de 5. 11 opiniones.
101,Tenis adidas Grand Court 2.0 Kids Id0736 adidas,$60,Calificación 4.8 de 5. 6 opiniones.
104,Tenis Star Wars 4uture Runner Para Niños Id5229 adidas,"$1,149",Calificación 4.8 de 5. 68 opiniones.
105,Tenis Grand Court Lifestyle Tira Regulable - Blanco adidas,$69,Calificación 5 de 5. 7 opiniones.
106,Tenis adidas Grand Court 2.0 Kids Id7861 adidas,"$1,099",Calificación 4.8 de 5. 287 opiniones.
107,Tenis Tensaur Run Ig1245 adidas,$66,Calificación 4.6 de 5. 14 opiniones.
